{
  "$schema": "https://json-schema.org/draft/2020-12/schema",
  "$id": "https://trace-cue.local/schemas/target-manifest.schema.json",
  "title": "TraceCue Target Manifest",
  "type": "object",
  "required": ["baseUrl"],
  "properties": {
    "baseUrl": { "type": "string" },
    "schemaVersion": { "type": "string" },
    "name": { "type": "string" },
    "scope": { "type": "object" },
    "seeds": { "type": "array", "items": { "type": "string" } },
    "expectedRoutes": { "type": "array", "items": { "type": "string" } },
    "pages": { "type": "array" },
    "sourceData": { "type": "array" },
    "localContentUxAdvisory": { "type": "object" },
    "viewportMatrix": { "type": "array" },
    "actionPolicy": { "type": "object" },
    "budgets": { "type": "object" },
    "artifacts": { "type": "object" },
    "masks": { "type": "array" },
    "regions": { "type": "array" },
    "appHints": { "type": "object" }
  },
  "additionalProperties": true
}
